<?xml version="1.0" encoding="UTF-8"?>
<!--Sample XML file generated by XMLSpy v2010 rel. 3 sp1 (http://www.altova.com)-->
<!DOCTYPE LIMES SYSTEM "limes.dtd">
<LIMES>
	<PREFIX>
		<NAMESPACE>http://www.w3.org/2002/07/owl#</NAMESPACE>
		<LABEL>owl</LABEL>
	</PREFIX>
	<SOURCE>
		<ID>linkedmdb</ID>
		<ENDPOINT>datasets/dbpedia-linkedmdb/source2.csv</ENDPOINT>
		<VAR>?x</VAR>
		<PAGESIZE>-1</PAGESIZE>
		<RESTRICTION></RESTRICTION>
		<PROPERTY>title AS lowercase->removebraces</PROPERTY>
		<PROPERTY>director AS lowercase->removebraces</PROPERTY>	
		<TYPE>CSV</TYPE>
	</SOURCE>
	<TARGET>
		<ID>dbpedia</ID>
		<ENDPOINT>datasets/dbpedia-linkedmdb/target2.csv</ENDPOINT>
		<VAR>?y</VAR>
		<PAGESIZE>-1</PAGESIZE>
		<RESTRICTION></RESTRICTION>
		<PROPERTY>title AS lowercase->removebraces</PROPERTY>
		<PROPERTY>director AS lowercase->removebraces</PROPERTY>	
		<TYPE>CSV</TYPE>
	</TARGET>
	
	<METRIC>OR(AND(AND(cosine(x.director,y.director)|0.55,jaccard(x.title,y.title)|0.62)|0.54,AND(cosine(x.director,y.director)|0.54,trigram(x.director,y.director)|0.54)|0.37)|0.69,jaccard(x.title,y.title)|0.62)</METRIC>
	<ACCEPTANCE>
		<THRESHOLD>0.91</THRESHOLD>
		<FILE>dbpedia-linkedmdb_accepted.txt</FILE>
		<RELATION>owl:sameAs</RELATION>
	</ACCEPTANCE>
	<REVIEW>
		<THRESHOLD>0.8</THRESHOLD>
		<FILE>dbpedia-linkedmdb_reviewme.txt</FILE>
		<RELATION>owl:sameAs</RELATION>
	</REVIEW>
		<EXECUTION>
		<REWRITER>default</REWRITER>
		<PLANNER>default</PLANNER>
		<ENGINE>default</ENGINE>
	</EXECUTION>
	<OUTPUT>N3</OUTPUT>
</LIMES>
