<?xml version="1.0" encoding="UTF-8"?>
<!DOCTYPE LIMES SYSTEM "limes.dtd">
<LIMES>
	<PREFIX>
		<NAMESPACE>http://www.w3.org/1999/02/22-rdf-syntax-ns#</NAMESPACE>
		<LABEL>rdf</LABEL>
	</PREFIX>
	<PREFIX>
		<NAMESPACE>http://www.w3.org/2000/01/rdf-schema#</NAMESPACE>
		<LABEL>rdfs</LABEL>
	</PREFIX>
	<PREFIX>
		<NAMESPACE>http://www.w3.org/2002/07/owl#</NAMESPACE>
		<LABEL>owl</LABEL>
	</PREFIX>
	<PREFIX>
		<NAMESPACE>http://www.okkam.org/ontology_person1.owl#</NAMESPACE>
		<LABEL>okkamperson1</LABEL>
	</PREFIX>
	<PREFIX>
		<NAMESPACE>http://www.okkam.org/ontology_person2.owl#</NAMESPACE>
		<LABEL>okkamperson2</LABEL>
	</PREFIX>
	<PREFIX>
		<NAMESPACE>http://www.okkam.org/ontology_restaurant2.owl#</NAMESPACE>
		<LABEL>okkamrestaurant2</LABEL>
	</PREFIX>
	<PREFIX>
		<NAMESPACE>http://www.okkam.org/ontology_restaurant1.owl#</NAMESPACE>
		<LABEL>okkamrestaurant1</LABEL>
	</PREFIX>
<SOURCE>
		<ID>restaurant1</ID>
		<ENDPOINT>datasets/Restaurants/restaurant1.nt</ENDPOINT>
		<VAR>?x</VAR>
		<PAGESIZE>1000</PAGESIZE>
		<RESTRICTION>?x rdf:type http://www.okkam.org/ontology_restaurant1.owl#Restaurant</RESTRICTION>
		<PROPERTY>http://www.okkam.org/ontology_restaurant1.owl#has_address AS lowercase</PROPERTY>
		<PROPERTY>http://www.okkam.org/ontology_restaurant1.owl#category AS lowercase</PROPERTY>
		<PROPERTY>http://www.okkam.org/ontology_restaurant1.owl#phone_number</PROPERTY>
		<PROPERTY>http://www.okkam.org/ontology_restaurant1.owl#name AS lowercase</PROPERTY>

		<TYPE>N3</TYPE>
</SOURCE>
	
	<TARGET>
		<ID>restaurant2</ID>
		<ENDPOINT>datasets/Restaurants/restaurant2.nt</ENDPOINT>
		<VAR>?y</VAR>
		<PAGESIZE>1000</PAGESIZE>
		<RESTRICTION>?x rdf:type http://www.okkam.org/ontology_restaurant2.owl#Restaurant</RESTRICTION>
		<PROPERTY>http://www.okkam.org/ontology_restaurant2.owl#has_address AS lowercase</PROPERTY>
		<PROPERTY>http://www.okkam.org/ontology_restaurant2.owl#phone_number</PROPERTY>
		<PROPERTY>http://www.okkam.org/ontology_restaurant2.owl#name AS lowercase</PROPERTY>

		<TYPE>N3</TYPE>
	</TARGET>	

	<METRIC>levenshtein(x.http://www.okkam.org/ontology_restaurant1.owl#name, y.http://www.okkam.org/ontology_restaurant2.owl#name)</METRIC>

	<ACCEPTANCE>
		<THRESHOLD>0.98</THRESHOLD>
		<FILE>accepted.txt</FILE>
		<RELATION>owl:sameAs</RELATION>
	</ACCEPTANCE>
	<REVIEW>
		<THRESHOLD>0.95</THRESHOLD>
		<FILE>reviewme.txt</FILE>
		<RELATION>owl:sameAs</RELATION>
	</REVIEW>
	
		<EXECUTION>
		<REWRITER>default</REWRITER>
		<PLANNER>default</PLANNER>
		<ENGINE>default</ENGINE>
	</EXECUTION>
	<OUTPUT>N3</OUTPUT>
</LIMES>
