<?xml version="1.0" encoding="UTF-8"?>
<!--Sample XML file generated by XMLSpy v2010 rel. 3 sp1 (http://www.altova.com)-->
<!DOCTYPE LIMES SYSTEM "limes.dtd">
<LIMES>
	<PREFIX>
		<NAMESPACE>http://www.w3.org/2002/07/owl#</NAMESPACE>
		<LABEL>owl</LABEL>
	</PREFIX>
	<SOURCE>
		<ID>amazon</ID>
		<ENDPOINT>datasets/Amazon-GoogleProducts/Amazon.csv</ENDPOINT>
		<VAR>?x</VAR>
		<PAGESIZE>-1</PAGESIZE>
		<RESTRICTION></RESTRICTION>
		<PROPERTY>title AS lowercase</PROPERTY>
		<PROPERTY>description AS lowercase</PROPERTY>
		<PROPERTY>manufacturer AS lowercase</PROPERTY>
		<PROPERTY>price AS number</PROPERTY>
		<TYPE>CSV</TYPE>
	</SOURCE>
	<TARGET>
		<ID>googleprod</ID>
		<ENDPOINT>datasets/Amazon-GoogleProducts/GoogleProducts.csv</ENDPOINT>
		<VAR>?y</VAR>
		<PAGESIZE>-1</PAGESIZE>
		<RESTRICTION></RESTRICTION>
		<PROPERTY>name AS lowercase</PROPERTY>
		<PROPERTY>description AS lowercase</PROPERTY>
		<PROPERTY>manufacturer AS lowercase</PROPERTY>
		<PROPERTY>price AS number</PROPERTY>
		<TYPE>CSV</TYPE>
	</TARGET>
	
	<METRIC>OR(cosine(x.title,y.name)|0.374142355670193,cosine(x.title,y.description)|0.39117335063587566)</METRIC>
	<ACCEPTANCE>
		<THRESHOLD>0.6065832358304951</THRESHOLD>
		<FILE>pub_accepted.txt</FILE>
		<RELATION>owl:sameAs</RELATION>
	</ACCEPTANCE>
	<REVIEW>
		<THRESHOLD>0.5</THRESHOLD>
		<FILE>pub_reviewme.txt</FILE>
		<RELATION>owl:sameAs</RELATION>
	</REVIEW>
	<EXECUTION>
		<REWRITER>default</REWRITER>
		<PLANNER>default</PLANNER>
		<ENGINE>default</ENGINE>
	</EXECUTION>
	<OUTPUT>N3</OUTPUT>
</LIMES>
