<?xml version="1.0" encoding="UTF-8"?>
<!--Sample XML file generated by XMLSpy v2010 rel. 3 sp1 (http://www.altova.com)-->
<!DOCTYPE LIMES SYSTEM "limes.dtd">
<LIMES>
	<PREFIX>
		<NAMESPACE>http://www.w3.org/2002/07/owl#</NAMESPACE>
		<LABEL>owl</LABEL>
	</PREFIX>
	<SOURCE>
		<ID>daily</ID>
		<ENDPOINT>datasets/dailymed-drugbank-ingredients/source2.csv</ENDPOINT>
		<VAR>?x</VAR>
		<PAGESIZE>-1</PAGESIZE>
		<RESTRICTION></RESTRICTION>
		<PROPERTY>name AS lowercase</PROPERTY>		
		<TYPE>CSV</TYPE>
	</SOURCE>
	<TARGET>
		<ID>drugbank</ID>
		<ENDPOINT>datasets/dailymed-drugbank-ingredients/target2.csv</ENDPOINT>
		<VAR>?y</VAR>
		<PAGESIZE>-1</PAGESIZE>
		<RESTRICTION></RESTRICTION>
		<PROPERTY>name AS lowercase</PROPERTY>
		<TYPE>CSV</TYPE>
	</TARGET>
	
	<METRIC>AND(cosine(x.name,y.name)|0.146,AND(AND(trigrams(x.name,y.name)|0.49,jaccard(x.name,y.name)|0.65)|0.51,trigrams(x.name,y.name)|0.51)|0.51)</METRIC>
	<ACCEPTANCE>
		<THRESHOLD>0.55</THRESHOLD>
		<FILE>dailymed_drugbank_incredients_accepted.txt</FILE>
		<RELATION>owl:sameAs</RELATION>
	</ACCEPTANCE>
	<REVIEW>
		<THRESHOLD>0.4</THRESHOLD>
		<FILE>dailymed_drugbank_incredients_reviewme.txt</FILE>
		<RELATION>owl:sameAs</RELATION>
	</REVIEW>
		<EXECUTION>
		<REWRITER>default</REWRITER>
		<PLANNER>default</PLANNER>
		<ENGINE>default</ENGINE>
	</EXECUTION>
	<OUTPUT>N3</OUTPUT>
</LIMES>
