<?xml version="1.0" encoding="UTF-8"?>
<!--Sample XML file generated by XMLSpy v2010 rel. 3 sp1 (http://www.altova.com)-->
<!DOCTYPE LIMES SYSTEM "limes.dtd">
<LIMES>
	<PREFIX>
		<NAMESPACE>http://www.w3.org/2002/07/owl#</NAMESPACE>
		<LABEL>owl</LABEL>
	</PREFIX>
	<SOURCE>
		<ID>abt</ID>
		<ENDPOINT>datasets/Abt-Buy/Abt.csv</ENDPOINT>
		<VAR>?x</VAR>
		<PAGESIZE>-1</PAGESIZE>
		<RESTRICTION></RESTRICTION>
		<PROPERTY>name AS lowercase</PROPERTY>
		<PROPERTY>description AS lowercase</PROPERTY>
		<PROPERTY>price AS number</PROPERTY>
		<TYPE>CSV</TYPE>
	</SOURCE>
	<TARGET>
		<ID>buy</ID>
		<ENDPOINT>datasets/Abt-Buy/Buy.csv</ENDPOINT>
		<VAR>?y</VAR>
		<PAGESIZE>-1</PAGESIZE>
		<RESTRICTION></RESTRICTION>
		<PROPERTY>name AS lowercase</PROPERTY>
		<PROPERTY>description AS lowercase</PROPERTY>
		<PROPERTY>price AS number</PROPERTY>
		<TYPE>CSV</TYPE>
	</TARGET>
	
	<METRIC>jarowinkler(x.name,y.name)</METRIC>
	<ACCEPTANCE>
		<THRESHOLD>0.5431</THRESHOLD>
		<FILE>pub_accepted.txt</FILE>
		<RELATION>owl:sameAs</RELATION>
	</ACCEPTANCE>
	
	<REVIEW>
		<THRESHOLD>0.5431</THRESHOLD>
		<FILE>pub_reviewme.txt</FILE>
		<RELATION>owl:sameAs</RELATION>
	</REVIEW>
        <EXECUTION>
		<REWRITER>default</REWRITER>
		<PLANNER>default</PLANNER>
		<ENGINE>default</ENGINE>
	</EXECUTION>

	<OUTPUT>N3</OUTPUT>
</LIMES>
