<?xml version="1.0" encoding="UTF-8"?>
<!--Sample XML file generated by XMLSpy v2010 rel. 3 sp1 (http://www.altova.com)-->
<!DOCTYPE LIMES SYSTEM "limes.dtd">
<LIMES>
	<PREFIX>
		<NAMESPACE>http://www.w3.org/2002/07/owl#</NAMESPACE>
		<LABEL>owl</LABEL>
	</PREFIX>
	<SOURCE>
		<ID>dblp1</ID>
		<ENDPOINT>datasets/DBLP-Scholar/DBLP1.csv</ENDPOINT>
		<VAR>?x</VAR>
		<PAGESIZE>-1</PAGESIZE>
		<RESTRICTION></RESTRICTION>
		<PROPERTY>title AS lowercase</PROPERTY>		
		<PROPERTY>authors AS lowercase</PROPERTY>
		<PROPERTY>venue AS lowercase</PROPERTY>
		<PROPERTY>year AS number</PROPERTY>
		<TYPE>CSV</TYPE>
	</SOURCE>
	<TARGET>
		<ID>scholar</ID>
		<ENDPOINT>datasets/DBLP-Scholar/Scholar.csv</ENDPOINT>
		<VAR>?y</VAR>
		<PAGESIZE>-1</PAGESIZE>
		<RESTRICTION></RESTRICTION>
		<PROPERTY>title AS lowercase</PROPERTY>
		<PROPERTY>authors AS lowercase</PROPERTY>
		<PROPERTY>venue AS lowercase</PROPERTY>
		<PROPERTY>year AS number</PROPERTY>
		<TYPE>CSV</TYPE>
	</TARGET>
	
	<METRIC>AND(trigram(x.title,y.title)|0.12740796168580043,cosine(x.title,y.title)|0.12740796168580043)</METRIC>
	<ACCEPTANCE>
		<THRESHOLD>0.4093475390922669</THRESHOLD>
		<FILE>dblp-scholar_accepted.txt</FILE>
		<RELATION>owl:sameAs</RELATION>
	</ACCEPTANCE>
	<REVIEW>
		<THRESHOLD>0.3</THRESHOLD>
		<FILE>dblp-scholar_reviewme.txt</FILE>
		<RELATION>owl:sameAs</RELATION>
	</REVIEW>
	<EXECUTION>
		<REWRITER>default</REWRITER>
		<PLANNER>default</PLANNER>
		<ENGINE>default</ENGINE>
	</EXECUTION>
	<OUTPUT>N3</OUTPUT>
</LIMES>
